{
  "schema_version": 1,
  "data_class": "synthetic",
  "run_id": "tiny-run",
  "generation": 1,
  "match_id": "actor-rule-argmax",
  "game": 0,
  "seed": "sodium,bfdc574f266c9bf10253487644144535",
  "version_manifest": {
    "showdown_commit": "7244fe8e28fa8bc4d0809ae30d183c608b62bb2b",
    "format_id": "gen9championsvgc2026regmc",
    "regulation": "M-C",
    "ruleset_hash": "4dd1f039bbcc6156e08c434972beae2370dc5fe8c9c6a263da7383c3247b68f3",
    "format_rules_hash": "549cd2aa97324be093c567324676d46a5eff19d6b0c9d8491c483dab746d5dcc"
  },
  "teams": {
    "p1": {
      "team": [
        {
          "name": "",
          "species": "Venusaur",
          "item": "Leftovers",
          "ability": "Overgrow",
          "moves": [
            "Giga Drain",
            "Sludge Bomb",
            "Protect",
            "Sleep Powder"
          ],
          "nature": "Serious",
          "gender": "",
          "evs": {
            "hp": 4,
            "atk": 0,
            "def": 0,
            "spa": 0,
            "spd": 0,
            "spe": 4
          },
          "ivs": {
            "hp": 31,
            "atk": 31,
            "def": 31,
            "spa": 31,
            "spd": 31,
            "spe": 31
          },
          "level": 50
        },
        {
          "name": "",
          "species": "Charizard",
          "item": "Charcoal",
          "ability": "Blaze",
          "moves": [
            "Flamethrower",
            "Air Slash",
            "Protect",
            "Heat Wave"
          ],
          "nature": "Serious",
          "gender": "",
          "evs": {
            "hp": 4,
            "atk": 0,
            "def": 0,
            "spa": 0,
            "spd": 0,
            "spe": 4
          },
          "ivs": {
            "hp": 31,
            "atk": 31,
            "def": 31,
            "spa": 31,
            "spd": 31,
            "spe": 31
          },
          "level": 50
        },
        {
          "name": "",
          "species": "Blastoise",
          "item": "Mystic Water",
          "ability": "Torrent",
          "moves": [
            "Surf",
            "Ice Beam",
            "Protect",
            "Fake Out"
          ],
          "nature": "Serious",
          "gender": "",
          "evs": {
            "hp": 4,
            "atk": 0,
            "def": 0,
            "spa": 0,
            "spd": 0,
            "spe": 4
          },
          "ivs": {
            "hp": 31,
            "atk": 31,
            "def": 31,
            "spa": 31,
            "spd": 31,
            "spe": 31
          },
          "level": 50
        },
        {
          "name": "",
          "species": "Pikachu",
          "item": "Light Ball",
          "ability": "Static",
          "moves": [
            "Thunderbolt",
            "Fake Out",
            "Protect",
            "Volt Switch"
          ],
          "nature": "Serious",
          "gender": "",
          "evs": {
            "hp": 4,
            "atk": 0,
            "def": 0,
            "spa": 0,
            "spd": 0,
            "spe": 4
          },
          "ivs": {
            "hp": 31,
            "atk": 31,
            "def": 31,
            "spa": 31,
            "spd": 31,
            "spe": 31
          },
          "level": 50
        },
        {
          "name": "",
          "species": "Snorlax",
          "item": "Sitrus Berry",
          "ability": "Thick Fat",
          "moves": [
            "Body Slam",
            "Protect",
            "Curse",
            "Rest"
          ],
          "nature": "Serious",
          "gender": "",
          "evs": {
            "hp": 4,
            "atk": 0,
            "def": 0,
            "spa": 0,
            "spd": 0,
            "spe": 4
          },
          "ivs": {
            "hp": 31,
            "atk": 31,
            "def": 31,
            "spa": 31,
            "spd": 31,
            "spe": 31
          },
          "level": 50
        },
        {
          "name": "",
          "species": "Gengar",
          "item": "Focus Sash",
          "ability": "Cursed Body",
          "moves": [
            "Shadow Ball",
            "Sludge Bomb",
            "Protect",
            "Icy Wind"
          ],
          "nature": "Serious",
          "gender": "",
          "evs": {
            "hp": 4,
            "atk": 0,
            "def": 0,
            "spa": 0,
            "spd": 0,
            "spe": 4
          },
          "ivs": {
            "hp": 31,
            "atk": 31,
            "def": 31,
            "spa": 31,
            "spd": 31,
            "spe": 31
          },
          "level": 50
        }
      ],
      "team_hash": "8c94996edd59777b4432a5202f3504c8a50cc0e26f68e00049df756963dedb06"
    },
    "p2": {
      "team": [
        {
          "name": "",
          "species": "Venusaur",
          "item": "Leftovers",
          "ability": "Overgrow",
          "moves": [
            "Giga Drain",
            "Sludge Bomb",
            "Protect",
            "Sleep Powder"
          ],
          "nature": "Serious",
          "gender": "",
          "evs": {
            "hp": 4,
            "atk": 0,
            "def": 0,
            "spa": 0,
            "spd": 0,
            "spe": 4
          },
          "ivs": {
            "hp": 31,
            "atk": 31,
            "def": 31,
            "spa": 31,
            "spd": 31,
            "spe": 31
          },
          "level": 50
        },
        {
          "name": "",
          "species": "Charizard",
          "item": "Charcoal",
          "ability": "Blaze",
          "moves": [
            "Flamethrower",
            "Air Slash",
            "Protect",
            "Heat Wave"
          ],
          "nature": "Serious",
          "gender": "",
          "evs": {
            "hp": 4,
            "atk": 0,
            "def": 0,
            "spa": 0,
            "spd": 0,
            "spe": 4
          },
          "ivs": {
            "hp": 31,
            "atk": 31,
            "def": 31,
            "spa": 31,
            "spd": 31,
            "spe": 31
          },
          "level": 50
        },
        {
          "name": "",
          "species": "Blastoise",
          "item": "Mystic Water",
          "ability": "Torrent",
          "moves": [
            "Surf",
            "Ice Beam",
            "Protect",
            "Fake Out"
          ],
          "nature": "Serious",
          "gender": "",
          "evs": {
            "hp": 4,
            "atk": 0,
            "def": 0,
            "spa": 0,
            "spd": 0,
            "spe": 4
          },
          "ivs": {
            "hp": 31,
            "atk": 31,
            "def": 31,
            "spa": 31,
            "spd": 31,
            "spe": 31
          },
          "level": 50
        },
        {
          "name": "",
          "species": "Pikachu",
          "item": "Light Ball",
          "ability": "Static",
          "moves": [
            "Thunderbolt",
            "Fake Out",
            "Protect",
            "Volt Switch"
          ],
          "nature": "Serious",
          "gender": "",
          "evs": {
            "hp": 4,
            "atk": 0,
            "def": 0,
            "spa": 0,
            "spd": 0,
            "spe": 4
          },
          "ivs": {
            "hp": 31,
            "atk": 31,
            "def": 31,
            "spa": 31,
            "spd": 31,
            "spe": 31
          },
          "level": 50
        },
        {
          "name": "",
          "species": "Snorlax",
          "item": "Sitrus Berry",
          "ability": "Thick Fat",
          "moves": [
            "Body Slam",
            "Protect",
            "Curse",
            "Rest"
          ],
          "nature": "Serious",
          "gender": "",
          "evs": {
            "hp": 4,
            "atk": 0,
            "def": 0,
            "spa": 0,
            "spd": 0,
            "spe": 4
          },
          "ivs": {
            "hp": 31,
            "atk": 31,
            "def": 31,
            "spa": 31,
            "spd": 31,
            "spe": 31
          },
          "level": 50
        },
        {
          "name": "",
          "species": "Gengar",
          "item": "Focus Sash",
          "ability": "Cursed Body",
          "moves": [
            "Shadow Ball",
            "Sludge Bomb",
            "Protect",
            "Icy Wind"
          ],
          "nature": "Serious",
          "gender": "",
          "evs": {
            "hp": 4,
            "atk": 0,
            "def": 0,
            "spa": 0,
            "spd": 0,
            "spe": 4
          },
          "ivs": {
            "hp": 31,
            "atk": 31,
            "def": 31,
            "spa": 31,
            "spd": 31,
            "spe": 31
          },
          "level": 50
        }
      ],
      "team_hash": "8c94996edd59777b4432a5202f3504c8a50cc0e26f68e00049df756963dedb06"
    }
  },
  "policies": {
    "p1": "policy:aaaaaaaaaaaaaaaaaaaaaaaaaaaaaaaaaaaaaaaaaaaaaaaaaaaaaaaaaaaaaaaa",
    "p2": "actor-rule@v1"
  },
  "decisions": [
    {
      "player": "p1",
      "request_seq": 1,
      "candidates": [
        {
          "choice": "team 1234",
          "pending": false
        },
        {
          "choice": "team 1235",
          "pending": false
        },
        {
          "choice": "team 1236",
          "pending": false
        },
        {
          "choice": "team 1243",
          "pending": false
        },
        {
          "choice": "team 1245",
          "pending": false
        },
        {
          "choice": "team 1246",
          "pending": false
        },
        {
          "choice": "team 1253",
          "pending": false
        },
        {
          "choice": "team 1254",
          "pending": false
        },
        {
          "choice": "team 1256",
          "pending": false
        },
        {
          "choice": "team 1263",
          "pending": false
        },